Programme,Section Title,Content Type,Speaker Name,Speaker Description,Segment Description,Date,Start Time,Duration,Subtitles
Tagesthemen,03 AfD im Höhenflug,O-Ton,"Wolfgang Schroeder (""Die AfD ist die Speerspitze des Kampfes gegen die Grünen""",die als die drängende,"(""Die AfD ist die Speerspitze des Kampfes gegen die Grünen"", die als die drängendeKraft der permanenten Veränderungsnotwendigkeit gesehen werden""; ""Die AfD begreift sich als dasNormale, die den Lebensstil der Leute schützt"")",2023-05-12,21:55:21.11,"0'23""",
Tagesthemen,Druck auf Robert Habeck: Heizungsstreit geht Do 23:14 01,Einspieler,,,,2023-05-12,,"2'41""","Hier ist das Erste Deutsche Fernsehen mit den tagesthemen. Diese Sendung wurde vom NDR live untertitelt (12.05.2023) Heute im Studio: Aline Abboud. Guten Abend und willkommen. Schoen, dass Sie dabei sind. Guten Abend. Frischer Wind macht nicht nur den Kopf frei. Manchmal sorgt er auch dafuer, dass Koepfe aneinander geraten. So wie jetzt, wenn es darum geht, ob es kuenftig in Nord und Sued unterschiedliche Strompreise geben sollte. Das hatten die norddeutschen Bundeslaender vorgeschlagen. Ihr Argument: Wenn ich dort lebe, wo die meiste Energie erzeugt wird, soll sie doch dort auch am guenstigsten sein. Damit hatten sie vor allem die Windkraft im Kopf. Das konnte der Sueden nicht auf sich sitzen lassen und pochte heute auf weiterhin einheitliche Preise. Er verwies auf seine wirtschaftliche Staerke, die sonst gefaehrdet sei. ÈUber die Diskussion berichten Fabian Siegel und Tim Diekmann. Fluessiges Aluminium, 720 Grad heiss. Daraus entstehen sollen Bauteile fuer die Autoindustrie. Das Pressen ist stromintensiv. Drei Gigawattstunden pro Jahr verbraucht diese Giesserei in Winterbach nach eigenen Angaben. Das gehe ins Geld, sagt der Geschaeftsfuehrer. Die Strompreise belasten uns unheimlich stark. Das ist ein grosser Anteil am Rohertrag letztendlich. Durch diese brutale Belastung werden wir immer weniger wettbewerbsfaehig. Auch die Mitarbeiter machen sich Sorgen. Ich habe Angst um meinen Job, dass er verloren geht aufgrund der Situation. Bald koennten die Unternehmen im Sueden fuer Strom noch mehr zahlen, wenn es nach den Ministerpraesidenten im Norden geht. Diese fuehlen sich benachteiligt. Die Strompreise sind ungerecht: Wir hier im Norden produzieren die gruene Energie aus grossen Windparks, schicken sie in den Sueden. Dort sind die niedrigen Strompreise, und bei uns, wo die Belastung ist, zahlen die Buergerinnen und Buerger die hoechsten Strompreise. Schuld ist das Stromnetzentgelt, mit dem die Netzbetreiber Investitionen auf die Kunden umlegen. Im Norden und Osten gab es bisher deutlich mehr Investitionen in die erneuerbaren Energien."
Tagesthemen,01 Druck auf Robert Habeck: Heizungsstreit geht weiter,Sachinhalt,Caren Miosga,Moderation,Wegen personeller Probleme im Bundeswirtschaftsministerium nach der Affäre um den ehemaligen Wirtschaftsstaatssekretär Patrick Graichen (Bündnis 90/Die Grünen) fordert die FDP eine Verlängerung des Zeitplans für das geplante Heizungsgesetz von Bundeswirtschaftsminister Robert Habeck (Bündnis 90/Die Grünen). SPD und Bündnis 90/Die Grünen wollen das Gesetz bis zur Sommerpause verabschieden. Bildinhalt,2023-05-18,23:15:48.22,"2'41""",
Tagesthemen,01 Druck auf Robert Habeck: Heizungsstreit geht weiter,Bildinhalt,Caren Miosga,Moderation,Archivmaterial 10.05.2023: Robert Habeck und Patrick Graichen nebeneinander bei Sitzung,2023-05-18,23:15:48.22,"0'13""",
Tagesthemen,01 Druck auf Robert Habeck: Heizungsstreit geht weiter,Bildinhalt,Caren Miosga,Moderation,"Presseberichterstattung Bild Online zu Entlassung von Patrick Graichen / Pressekonferenz: Bijan Djir-Sarai, Generalsekretär FDP",2023-05-18,23:16:14.21,"0'13""",
Tagesthemen,01 Druck auf Robert Habeck: Heizungsstreit geht weiter,Bildinhalt,Caren Miosga,Moderation,"Archivmaterial: 19.04.2023: Vor Sitzung Bundeskabinett, Robert Habeck im Gespräch mit Christian Lindner und Marco Buschmann; Olaf Scholz nimmt Platz",2023-05-18,23:16:28.01,"0'08""",
Tagesthemen,01 Druck auf Robert Habeck: Heizungsstreit geht weiter,Bildinhalt,Caren Miosga,Moderation,Archivmaterial: Schnittbilder Einbau Wärmepumpen,2023-05-18,23:16:59.06,"0'18""",
Tagesthemen,01 Druck auf Robert Habeck: Heizungsstreit geht weiter,Bildinhalt,Caren Miosga,Moderation,Wehende SPD-Fahne auf Parteizentrale,2023-05-18,23:17:37.21,"0'06""",
Tagesthemen,01 Druck auf Robert Habeck: Heizungsstreit geht weiter,Bildinhalt,Caren Miosga,Moderation,"Archivmaterial 10.05.2023: Robert Habeck und Patrick Graichen nebeneinander bei Sitzung / Bundesministerium für Wirtschaft und Klimaschutz (Gebäude, Schild)",2023-05-18,23:17:54.17,"0'11""",
Tagesthemen,01 Druck auf Robert Habeck: Heizungsstreit geht weiter,Bildinhalt,Caren Miosga,Moderation,15.11.2023 09:50 Seite 17 von 57 NDR Copyright (c) 2004,2023-05-18,23:18:05.22,"0'14""",
Tagesthemen,01 Druck auf Robert Habeck: Heizungsstreit geht weiter,Bildinhalt,Caren Miosga,Moderation,Schnittbilder Robert Habeck O-Ton,2023-05-18,23:18:20.22,"0'09""",
Tagesthemen,01 Druck auf Robert Habeck: Heizungsstreit geht weiter,O-Ton,Michael Kruse,Fraktion FDP,"(zum Gebäudeenergiegesetz: Es gibt viele Dinge, die an diesem Gesetzgeändert werden müssen. Deswegen muss es zurück in die Montagehalle und dann in einem neuen Entwurfim Bundestag beraten werden)",2023-05-18,23:16:06.21,"0'07""",
Tagesthemen,01 Druck auf Robert Habeck: Heizungsstreit geht weiter,O-Ton,Andreas Audretsch,stellvertretender Fraktionsvorsitzender Bündnis 90/Die Grünen,"(Was wichtig ist, dasGebäudeenergiegesetz wird vor dem Sommer beschlossen und, dazu haben sich der Kanzler und derFinanzminister im Koalitionsausschuss und auch noch einmal im Kabinett verpflichtet. Die Zustimmungensind erteilt, und jetzt ist es auch an den Fraktionen im Deutschen Bundestag, das vor der Sommerpause einBeschluss herbeigeführt wird, dass dieses wichtige Gesetz für den Klimaschutz rechtzeitig beschlossen wird)",2023-05-18,23:16:37.01,"0'22""",
Tagesthemen,01 Druck auf Robert Habeck: Heizungsstreit geht weiter,O-Ton,Julia Klöckner,Fraktion CDU/CSU,"(Ich erwarte von Minister Habeck, dass er jetzt einfach mal auf dieStopptaste drückt, dass er nicht mit der Brechstange versucht, ein Gesetz durchzudrücken, was gegen jedewissenschaftliche Berechnung, was auch gegen die Wünsche und Bedürfnisse der Bürgerinnen und Bürgerist)",2023-05-18,23:17:21.21,"0'15""",
Tagesthemen,01 Druck auf Robert Habeck: Heizungsstreit geht weiter,O-Ton,Nina Scheer,Fraktion SPD,,2023-05-18,23:17:48.11,"0'06""",
Tagesthemen,Habecks neuer Staatssekretär und seine Mo 22:14 01,Einspieler,,,,2023-05-18,,"2'32""","Hier ist das Erste Deutsche Fernsehen mit den tagesthemen. Diese Sendung wurde vom NDR live untertitelt (18.05.2023) Heute im Studio: Caren Miosga und Thorsten Schroeder. Schoen, dass Sie so spaet noch dabei sind.Guten Abend. Nach dem Rauswurf von Habecks Staatssekretaer streitet die Regierung ueber das von ihm entworfene Gesetz. Also die Frage, wie wir kuenftig heizen werden. Dass die Gelben und die Gruenen in der Klimapolitik nicht miteinander warm werden: Das ist klar und hat auch den roten Kanzler nicht kalt gelassen. Nur muehsam hatte sich die Ampel geeinigt, das gruene Gesetz zum Austausch von ÈOl- Und Gasheizungen bis zur Sommerpause zu verabschieden. Nun scheint die FDP die Schwaeche des Wirtschaftsministers zu nutzen, um dessen Plaene doch noch auszubremsen. Frank Jahn. Robert Habecks rechte Hand fuer die Energiewende, Patrick Graichen, musste seinen Stuhl raeumen. Nun gebe es ein Machtvakuum im gruenen Wirtschaftsministerium, sagt die FDP. Der Koalitionspartner will nicht nur den Zeitplan fuer das Heizungsgesetz aendern. An diesem Gesetz muss vieles geaendert werden. Es muss zurueck in die Montagehalle und dann neu beraten werden. Von 100 offenen Fragen an Habeck spricht der FDP-Generalsekretaer. Die FDP zweifelt an der Praxistauglichkeit des Gesetzes und haelt die geplante Verabschiedung vor der Sommerpause fuer ausgeschlossen. Die Gruenen fordern Verlaesslichkeit der Koalitionspartner ein und wollen am Zeitplan festhalten, den die Ampelspitze verabredet habe. Wichtig ist, dass das Gebaeudeenergiegesetz vor dem Sommer beschlossen wird. Dazu haben sich der Kanzler und der Finanzminister verpflichtet, die Zustimmungen sind erteilt. Jetzt ist es an den Fraktionen im Bundestag: Dass vor der Sommerpause das wichtige Gesetz fuer den Klimaschutz rechtzeitig beschlossen wird. Laut Gesetzentwurf soll ab 2024 jede neu eingebaute Heizung ueberwiegend mit erneuerbaren Energien betrieben werden."
Tagesthemen,01 Habecks neuer Staatssekretär und seine Baustellen,Sachinhalt,Helge Fuhst,Moderation,"Philipp Nimmermann wird neuer Staatssekretär im Bundeswirtschaftsministerium. Bundeswirtschaftsminister Robert Habeck lobte Nimmermann als erfahrenen Staatssekretär mit ökonomischer Expertise und viel Verwaltungserfahrung, der die Energiewende, die Wärmewende und die Transformation voranbringen werde. Bildinhalt",2023-05-22,22:16:12.23,"2'32""",
Tagesthemen,01 Habecks neuer Staatssekretär und seine Baustellen,Bildinhalt,Helge Fuhst,Moderation,Robert Habeck bei Pressekonferenz,2023-05-22,22:16:12.23,"0'08""",
Tagesthemen,01 Habecks neuer Staatssekretär und seine Baustellen,Bildinhalt,Helge Fuhst,Moderation,Fotos: Philipp Nimmermann,2023-05-22,22:16:21.04,"0'31""",
Tagesthemen,01 Habecks neuer Staatssekretär und seine Baustellen,Bildinhalt,Helge Fuhst,Moderation,Robert Habeck bei Pressekonferenz,2023-05-22,22:17:16.02,"0'22""",
Tagesthemen,01 Habecks neuer Staatssekretär und seine Baustellen,Bildinhalt,Helge Fuhst,Moderation,Archivmaterial: Heizungsanlage,2023-05-22,22:18:02.06,"0'09""",
Tagesthemen,01 Habecks neuer Staatssekretär und seine Baustellen,Bildinhalt,Helge Fuhst,Moderation,Robert Habeck bei Pressekonferenz O-Ton,2023-05-22,22:18:23.08,"0'21""",
Tagesthemen,01 Habecks neuer Staatssekretär und seine Baustellen,O-Ton,Robert Habeck,Bundesminister für Wirtschaft und Klimaschutz/Bündnis 90/Die Grünen,(über PhilippNimmermann),2023-05-22,22:16:31.00,"0'15""",
Tagesthemen,01 Habecks neuer Staatssekretär und seine Baustellen,O-Ton,Andreas Jung,Fraktion CDU/CSU,"(Forderungen für Wärmewende: Lösungen erarbeiten, die praxistauglichsind, die von den Handwerkern umgesetzt werden können, die technologieoffen sind, nicht diese Einseitigkeitmit Blick auf Wärmepumpe)",2023-05-22,22:17:01.16,"0'14""",
Tagesthemen,01 Habecks neuer Staatssekretär und seine Baustellen,O-Ton,Bijan Djir-Sarai,Generalsekretär FDP,"(zum Gebäudeenergiegesetz: Wenn man sich ansieht, was auf demTisch liegt, das ist eine so große Baustelle, dass ich mir nicht vorstellen kann, dass wir in dieserSitzungswoche geschweige denn vor der Sommerpause ein Ergebnis erzielen können)",2023-05-22,22:17:46.13,"0'15""",
Tagesthemen,01 Habecks neuer Staatssekretär und seine Baustellen,O-Ton,Saskia Esken,Vorsitzende SPD,"(Wenn wir klimaneutral werden wollen - und dass müssen wir - muss dieWärmewende jetzt eingeleitet werden - auch ambitioniert eingeleitet werden, nachdem man in denvergangenen 16 Jahren keinen Mut dazu gefunden hat)",2023-05-22,22:18:11.15,"0'11""",
Tagesthemen,Schaltgespräch mit Marie-Agnes Strack- Di 22:18 02,Einspieler,,,,2023-05-22,,"6'37""","Hier ist das Erste Deutsche Fernsehen mit den tagesthemen. Diese Sendung wurde vom NDR live untertitelt (22.05.2023) Heute im Studio: Helge Fuhst. Herzlich willkommen zu den tagesthemen. Einen guten Abend auch von mir! Auf den Ruecktritt folgt ein Antritt. Ein neuer Staatssekretaer im Wirtschaftsministerium soll die Energiewende voranbringen. Philipp Nimmermann, gleich erfahren wir mehr ueber ihn. Die Augen werden weiter auf ihn gerichtet sein. Robert Habeck steht fuer die Energiewende und den Kampf gegen den Klimawandel wie kein anderer in der Regierung. Er schaut auf die grossen Aufgaben, die weiter sind, vor allem nachdem Vertrauen verloren gegangen ist. Nicht nur das soll zurueckgewonnen werden, es duerfen sich auch handwerkliche Fehler nicht wiederholen. Jeder zukuenftige Gesetzentwurf in der Energiewende muss sitzen und zuerst die kritischen Reihen in der Ampel-Koalition ueberstehen. Keine kleine Aufgabe fuer Habeck und seinen neuen Staatssekretaer. Lob fuer den Wirtschaftsminister gab es schon lange nicht mehr. Robert Habeck versucht es mit Lob fuer andere, fuer seinen neuen Staatssekretaer. Philip Nimmermann kommt vom hessischen Wirtschaftsministerium. Er ist promovierter ÈOkonom. Habeck kennt ihn als Finanzstaatssekretaer in Schleswig-Holstein. Er ist ein erfahrener Verwaltungschef, seit vielen Jahren Staatssekretaer. Er ist ein Kenner von Energiemaerkten und ein guter ÈOkonom, der die Energiewende mit Leidenschaft bereichern wird. Wichtig: Nimmermann hat keine bisher bekannten Verwandtschaften ins Wirtschaftsministerium. Mehr interessiert die Opposition heute nicht. Sie will kaum ueber den Neuen reden, stellt aber neue Forderungen zur Waermewende auf. Dass man Loesungen erarbeitet, die praxistauglich sind. Die von den Handwerkern umgesetzt werden koennen, die technologieoffen sind. Nicht diese Einseitigkeit mit der Waermepumpe, sondern die breiten Moeglichkeiten oekologischen Heizens. Kopfzerbrechen bereitet Habeck heute nicht die Union, sondern sein Koalitionspartner FDP, der das Gesetz bremsen will. Der Einstieg in den Ausstieg aus dem Verbrennen von ÈOl und Gas sollte nun gegangen werden. So ist es politisch vereinbart worden. So wie von uns Vertragstreue erwartet wird, erwarte ich das auch von den Koalitionspartnern. Stattdessen legt die FDP heute noch einmal nach. Habecks Gesetz sei nicht beschlussreif, weil nicht durchdacht. Wenn man sich anschaut, was auf dem Tisch liegt, ist es eine grosse Baustelle. Ich kann mir nicht vorstellen, dass wir vor der Sommerpause ein Ergebnis erzielen koennen. Neue Heizungen sollten fuer jeden bezahlbar sein. Sie muessten aber schnell kommen, sagt die SPD. Wenn wir klimaneutral werden wollen, muss die Waermewaende jetzt eingeleitet werden. Sie muss ambitioniert eingeleitet werden, weil man in den letzten 16 Jahren keinen Mut dazu hatte. Beim Zeitplan bekommt Habeck Unterstuetzung im Koalitionskonflikt. Den naechsten hat er schon vom Zaun gebrochen. Zur Freude von Wirtschaft und Gewerkschaften will er 2024 subventionierten Strom fuer die Industrie anbieten. Das duerfte beim FDP-Finanzminister auf wenig Gegenliebe stossen. Es gibt auch gute Nachrichten beim Strom- und Gaspreis fuer Verbraucher: Sie sinken endlich! Das hat das Verbraucherportal Verivox festgestellt. Die Energiepreise auf dem Weltmarkt sind laengst gefallen und niedriger als vor dem russischen Angriffskrieg. Trotzdem hat es gedauert, bis Privathaushalte davon profitieren koennen. Zum Glueck haben sich die Gasuhren im milden Winter nicht so schnell gedreht. Trotzdem merken auch Unternehmer: Es koennte sein, dass sie nicht mehr lange durchhalten. Mittagsbetrieb in der Baeckerei Korte: Statt ganzer werden hier vor allem halbe und Viertelbrote verkauft. Soeren Korte spuert, die hohen Preise machen seinen Kunden zu schaffen. Fuer ihn selbst sind die hohen Energiepreise sogar existenzbedrohend. Wir muessen gucken, die Preise eventuell noch erhoehen. Einfach gucken, wo wir Einsparpotenziale einholen koennen. Die ÈOfen statt auf 290 Grad nur auf 280 Grad heizen, dafuer fuenf Minuten laenger. Bis August ist er an den alten Stromvertrag gebunden. Danach koennte es noch teurer werden, so sein Versorger. Von fallenden Preisen ist in der Baeckerei noch nichts zu spueren. Innerlich freut man sich, dass die Energiepreise runtergehen, aber es ist doch die Frage, wann kommt es an. Die Einkaufspreise fallen an den Energiemaerkten seit Jahresbeginn. Erste Grundversorger geben das an ihre Kunden weiter. Grundversorger sind Unternehmen, die regional die meisten Haushalte mit Strom und Gas beliefern. Laut einer Analyse von Verivox senken von Mai bis Juli insgesamt 91 Strom- und 80 Gasfirmen ihre Grundversorgungstarife. Strom wird dabei im Schnitt um 12 % guenstiger, Gas um 23 %. Doch das Preisniveau bleibt hoch, so Verivox. Das haengt mit der Beschaffungsstrategie zusammen. Gerade Grundversorger kaufen langfristig Strom und Gas ein. Die haben gerade noch die hohen Preise zu schultern und koennen daher Preise nicht senken. Wir beobachten sehr grosse Preisunterschiede. Es gibt Energieversorger, die erhoehen sogar noch die Preise. Die Preisbremsen der Bundesregierung liegen bei 40 Cent pro kwH Strom und 12 Cent beim Gas. Doch 80 % aller Strom- und 90 % der Gastarife in der Grundversorgung liegen darueber. Verbraucher profitieren von sinkenden Preisen am Strom- und Gasmarkt Ð und zwar als Neukunden. Denn die zahlen in der Regel weniger."
Tagesthemen,02 Schaltgespräch mit Marie-Agnes Strack-Zimmermann in Berlin:,Sachinhalt,Helge Fuhst,Moderation,"Die Regierungsfraktionen von SPD, Bündnis 90/Die Grünen und FDP haben die Einbringung des Gebäudeenergiegesetzes (Heizungsgesetzes) in den Bundestag verschoben. Hintergrund sind grundsätzliche Bedenken der FDP. Der Koalitionspartner besteht - anders als SPD und Grüne - auf eine grundsätzliche Überarbeitung des Gesetzentwurfs. Damit sinkt die Wahrscheinlichkeit, dass das Gesetz - wie ursprünglich geplant - noch vor der parlamentarischen Sommerpause verabschiedet wird. O-Ton",2023-05-23,22:22:41.19,"6'37""",
Tagesthemen,02 Schaltgespräch mit Marie-Agnes Strack-Zimmermann in Berlin:,O-Ton,Marie-Agnes Strack-Zimmermann,Fraktion FDP,"(zur Frage, wem ein öffentlich ausgetragener Streit in derRegierungskoalition dient: 66 Millionen Deutschen, denn die sind davon betroffen, wenn ein solches Gesetzauf den Weg gebracht wird. Und die meisten davon wollen eine Veränderung, aber sie wollen esnachvollziehen. Was kommt auf Sie zu? Was kostet es? Wie schnell kommt es? Denn all diese 66 Millionen -also ich berechne sozusagen die, die über 20 Jahre alt sind, Mieter sind, Vermieter sind, ein Häuschenhaben - die haben, glaube ich, ein Anrecht, dass man darüber diskutiert. Die verstehen das auch. Vor allenDingen sind sie sehr beunruhigt, weil die Kommunikation aus dem Hause Habeck bisher unglücklich war.Und insofern, glaube ich, sollten wir verbal abrüsten und an die Menschen denken, um dies letztendlich geht)",2023-05-23,22:22:57.13,"0'42""",
Tagesthemen,02 Schaltgespräch mit Marie-Agnes Strack-Zimmermann in Berlin:,O-Ton,Marie-Agnes Strack-Zimmermann (zur Frage,warum der Streit nicht hinter den Kulissen ausgetragen wird:,"(zur Frage, warum der Streit nicht hinter den Kulissen ausgetragen wird:Nein, ich glaube, für die Menschen, von denen wir jetzt wir beide jetzt sprechen, die wollen natürlich eineDiskussion, weil es kommt sehr darauf an, was am Ende dabei rauskommt. Ob die jetzt besonders15.11.2023 09:50 Seite 20 von 57 NDR Copyright (c) 2004",2023-05-23,22:23:50.23,"0'55""",
Tagesthemen,02 Schaltgespräch mit Marie-Agnes Strack-Zimmermann in Berlin:,O-Ton,Marie-Agnes Strack-Zimmermann (zur Frage,ob die Grünen bald nicht mehr mit der FDP regieren wollen:,"(zur Frage, ob die Grünen bald nicht mehr mit der FDP regieren wollen:Nein, das glaube ich nicht. Ich glaube, das ist natürlich jetzt so - das räume ich Ihnen auch ein, als Journalist- dass Sie natürlich eine solche Diskussion - hat, ja auch was prickelndes und erfrischendes -je nachdem, wieman darüber berichtet. Entscheidend ist doch das Ergebnis, was dabei hinten rauskommt. Und wir habenzwei Spielfelder. Das eine ist ein Gesetz auf den Weg zu bringen, um ökologisch wirklich in die Vorderhandzu kommen, nämlich eine Heizung auszutauschen, damit wir in den nächsten 25 bis 30 Jahren auch einrichtiges Gesetz gemacht haben. Auf der anderen Seite schauen wir jetzt auf die verschiedenenProtagonisten, die darüber beraten. Und ich glaube, diese beiden Felder sollte man nicht vermischen. Ichglaube, uns allen - der Ampel ist gediehen, dass wir ein Gesetz auf den Weg bringen, was die Menschenakzeptieren, was sie nachvollziehen können. Gefährlich wäre jetzt, innerhalb von vier Wochen etwas auf denWeg zu bringen und dann werden die Fragen beantwortet: Wer bezahlt etwas? Wer wird unterstützt? AlsoSie sehen, da sind noch viele Fragen offen und ich glaube, es tut uns allen gut, wenn wir das mal runterdämmen und uns um die Sache kümmern und in der Sache diskutieren)",2023-05-23,22:25:10.13,"1'09""",
Tagesthemen,02 Schaltgespräch mit Marie-Agnes Strack-Zimmermann in Berlin:,O-Ton,Marie-Agnes Strack-Zimmermann (zur Frage,ob bei dem öffentlichen Streit überhaupt noch Vertrauen in der,"(zur Frage, ob bei dem öffentlichen Streit überhaupt noch Vertrauen in derRegierungskoalition entstehen kann: Doch, das glaube ich schon. Also ich meine, dass da einige sauer sind,das kann man jetzt nicht übersehen. Aber ich muss mich wiederholen, es geht doch nicht um Gräben. Oderwer sitzt jetzt in einem Graben. Also bei einem Graben - das ist nicht das Thema. Das Thema ist, was kommtam Ende dabei raus. Und ich wiederhole mich ungern. Es sind über 66 Millionen Menschen davon betroffen.Und wenn das Gesetz in Kraft tritt, dann wird es nicht mehr die Frage sein, wer sitzt in welchem Graben,sondern dann werden die Leute zu Recht sagen: Mensch Regierung, was habt ihr da auf den Weg gebracht?Wie kurzsichtig war das, ohne die Probleme zu lösen und ohne die Fragen zu beantworten. Und deswegen,glaube ich, sollten wir alle verbal einmal tief durchatmen, an einen Tisch und setzen und uns die Zeitnehmen, die wir brauchen, um was Gescheites auf den Weg zu bringen. Etwas Gescheites, was dienächsten Jahrzehnte auch tragen muss. Das ist also nicht irgendein Gesetz, was mal irgendwie so saloppüber die Bühne geht. Und ich glaube, darum geht es und nicht, ob jetzt einer sauer ist oder nicht)",2023-05-23,22:26:48.01,"1'02""",
Tagesthemen,02 Schaltgespräch mit Marie-Agnes Strack-Zimmermann in Berlin:,O-Ton,Marie-Agnes Strack-Zimmermann (zur Frage,"ob sie es ausschließt, dass das Gesetz noch vor der","(zur Frage, ob sie es ausschließt, dass das Gesetz noch vor derSommerpause durch den Bundestag geht: Nein, das wird vor der Sommerpause mit Sicherheit nichtgeschehen können, denn es gibt über hundert Fragen, die wir gestellt haben. Wir brauchen Antworten, umdas zu begleiten. Das ist übrigens in einem Verfahren auch nichts Ungewöhnliches, dass ein Gesetz erst malim Kabinett ist und dann sozusagen den Parlamentariern vorgelegt wird, da gibt es viele Beispiele. Und dieseFragen müssen im Interesse der 66 Millionen Menschen beantwortet werden. Und wie gesagt, es geht dochnicht darum, bis zum 9. Juli ein Gesetz zu haben, als ob das Leben danach nicht weitergeht, sondern einGesetz auf den Weg zu bringen, was nachhaltig ist, was die Menschen mitnimmt und was die Akzeptanz -und ich glaube, dass es bei dem Thema wirklich von hoher Relevanz - dass wir die Menschen mitnehmenund sie es akzeptieren, was wir machen. Und die Unruhe ist gigantisch. Das werden Sie in Ihrem Freundes-,Bekannten-, Familienkreis auch hören. Keiner weiß mehr, was Sache ist. Jeder fragt brauche ich jetzt eineneue Heizung oder nicht? Und ich glaube, deswegen ist es sehr wichtig, dass wir intern in der Tat verbalabrüsten, aber uns um die Sache selber kümmern. Und ich bin optimistisch, vielleicht, weil ich aus demRheinland komme. Aber ich glaube schon, dass wir was Gutes auf den Weg bringen)",2023-05-23,22:27:58.12,"1'07""",
Tagesthemen,Ampelstreit um Heizungsgesetz - Showdown undDi 22:18 01,Einspieler,,,,2023-05-23,,"2'49""","Hier ist das Erste Deutsche Fernsehen mit den tagesthemen. Dieses Sendung wurde vom NDR live untertitelt (23.05.2023) Heute im Studio: Helge Fuhst und Judith Rakers. Wir begruessen Sie herzlich. Schoen, dass Sie dabei sind! Guten Abend. Diese Regierung scheint sich nicht mehr gruen zu sein. Habecks Heizungsprojekt, Teil der Energiewende, ist ausgebremst. Von den Flitterwochen der Ampel im Herbst 2021 sind nur Selfie-Erinnerungen uebrig. Der heutige Tag ist der Hoehepunkt des Streits beim Thema Klimaschutz, zwischen FDP und Gruenen. Auch die SPD ist genervt, wie ihr Fraktionschef sagte. Die Kanzlerpartei ist mal naeher an der FDP, mal an den Gruenen. Dieser Tage muss die SPD den Laden ueberhaupt zusammenhalten. Niemand soll auf die Idee kommen, es sei besser, nicht zu regieren, als in der Ampel zu sein. Dazu spreche ich gleich mit Marie-Agnes Strack-Zimmermann (FDP). Zunaechst Iris Sayram ueber Ampel-Chaos und einen umstrittenen Gesetzentwurf. Es weht ein rauer Wind heute um den Reichstag Ð auch politisch. Erst laesst die FDP das umstrittene Heizungsgesetz nicht auf die Tagesordnung. Dann stellt die Gruene-Fraktionsvorsitzende auf Sturm: Das ist mehr als bedauerlich. Damit ist die Handlungsfaehigkeit und die Arbeitsfaehigkeit unserer Ampel nimmt Schaden. In der Vergangenheit immer bekannt als ehrlicher Kaufmann. Das gilt offenbar fuer Christian Linder nicht mehr. Es geht mal wieder um das Gebaeudeenergiegesetz. Rueckblick: Bereits 2022 hatte die Ampel wesentliche Punkte beschlossen: Das Einbauverbot neuer Gas- und ÈOlheizungen ab 2024. Doch seit ein erster Entwurf an die Presse ging, sind die Schlagzeilen verheerend: Entsprechend turbulent verlief die Diskussion in der Ampel. Nach einer Marathon-Sitzung gibt es die Zustimmung der FDP. Dass sie die Beratung im Parlament blockiert, nennt Wirtschaftsminister Habeck so: Dass es nicht aufgesetzt wird, ist aus meiner Sicht ein Wortbruch. Die FDP will davon nichts wissen: Die Bedenken hat die FDP frueh markiert."
