Programme,Section Title,Content Type,Speaker Name,Speaker Description,Segment Description,Date,Start Time,Duration,Subtitles
Tagesschau,Schaltung zu Matthias Deiß in Berlin: Einigung Fr 20:00 01,Einspieler,,,,,,"2'20""",
Tagesschau,Details Heizungsgesetz Sa 20:00 01,Einspieler,,,,2023-03-31,,"2'03""",
Tagesschau,01 Details Heizungsgesetz,Bildinhalt,Judith Rakers,Moderation,"Symbolbilder Gebäudeenergiegesetz: verschiedene Heizungsanlage, u.a. Wärmepumpe, teilweise EINB Schriftgrafik",2023-04-01,20:00:42.06,"0'34""",
Tagesschau,01 Details Heizungsgesetz,Bildinhalt,Judith Rakers,Moderation,Grafik Pläne Gebäudeenergiegesetz Neubau O-Ton,2023-04-01,20:01:36.03,"0'13""",
Tagesschau,01 Details Heizungsgesetz,O-Ton,Ricarda Lang,Vorsitzende Bündnis 90/Die Grünen,(Für Menschen mit einem geringen Einkommen soll eineWärmepumpe nicht mehr kosten als ne Gasheizung; weitere Maßnahmen sind Krediterleichterungen;Kreditkonditionen),2023-04-01,20:01:49.18,"0'17""",
Tagesschau,01 Details Heizungsgesetz,O-Ton,Nadine Bader,Korrespondent,Aufsager,2023-04-01,20:02:29.02,"0'16""",
Tagesschau,Förderprogramm für Austausch alter Heizungen So 20:00 01,Einspieler,,,,2023-04-01,,"1'38""","Hier ist das Erste Deutsche Fernsehen mit der tagesschau. Diese Sendung wurde vom NDR live untertitelt (01.04.2023) Heute im Studio: Judith Rakers. Guten Abend, ich begruesse Sie zur tagesschau. Der Kompromiss der Ampel-Regierung zum Austausch von Heizungen stoesst auf Kritik. Im Kern soll es dabei bleiben, dass neue Heizungen zu 65 % mit erneuerbaren Energien betrieben werden muessen. Geplant sind aber Ausnahmen und ÈUbergangsfristen. Union und Linkspartei bemaengeln, dass die Foerderung noch unklar sei. Heizen mit Erdgas oder Heizoel Ð in Deutschland bisher die Regel. Mehr als 80 % der Waerme stammt aus fossilen Energien. Das soll sich aendern. Ab 2024 soll jede neue Heizung zu 65 % mit erneuerbaren Energien betrieben werden. Aber es gilt: keine generelle Austauschpflicht. Kaputte alte Heizungen koennen repariert werden. Ist dies nicht moeglich, gelten ÈUbergangsfristen fuer den Umstieg. Keine Pflicht umzusteigen gibt es fuer ueber 80-Jaehrige. Dem Sozialverband reichen die Ausnahmen nicht. Wir fordern mehr Parameter als nur eine Altersgrenze. Etwa die Betreuung von Pflegebeduerftigen, finanzielle Moeglichkeiten, Betreuung pflegebeduerftiger Kinder. Das muss eine Rolle spielen, wenn es darum geht, wer einen Beitrag leisten soll."
Tagesschau,01 Förderprogramm für Austausch alter Heizungen,Sachinhalt,Jens Riewa,Moderation,"Nachdem die Ampel-Koalition einen Kompromiss beim umstrittenen Gebäudeenergiegesetz mit dem Verbot des Einbaus neuer Gas- und Ölheizungen bekannt gegeben hat, arbeitet sie jetzt an einem Förderprogramm. Laut Bundesfinanzministerium soll es eine Art Abwrackprämie für alte Anlagen geben, deren Höhe vom Zustand der Anlage abhängig sein soll. Im ""Bericht aus Berlin"" nannte Bundeswirtschaftsminister Robert Habeck weitere Möglichkeiten, wie die finanzielle Entlastung gestaltet werden kann. Bildinhalt",2023-04-02,20:00:53.18,"1'38""",
Tagesschau,01 Förderprogramm für Austausch alter Heizungen,Bildinhalt,Jens Riewa,Moderation,"Archivmaterial: Hausbesitzer lässt sich für die Umrüstung seiner Heizung beraten, Heizungsbauer im Keller",2023-04-02,20:00:50.01,"0'18""",
Tagesschau,01 Förderprogramm für Austausch alter Heizungen,Bildinhalt,Jens Riewa,Moderation,"Grafik: Stellungnahme Christian Lindner, Bundesminister der Finanzen/Vorsitzender FDP",2023-04-02,20:01:08.22,"0'10""",
Tagesschau,01 Förderprogramm für Austausch alter Heizungen,Bildinhalt,Jens Riewa,Moderation,"Regieraum ""Bericht aus Berlin"" (mehrmals) Bundeswirtschaftsminister Robert Habeck im Studiointerview",2023-04-02,20:01:19.19,"0'32""",
Tagesschau,01 Förderprogramm für Austausch alter Heizungen,Bildinhalt,Jens Riewa,Moderation,"Bundesbauministerin Klara Geywitz im Studiointerview von ""Berlin Direkt"" (ZDF)",2023-04-02,20:01:52.06,"0'21""",
Tagesschau,01 Förderprogramm für Austausch alter Heizungen,Bildinhalt,Jens Riewa,Moderation,Handwerker liefern neue Wärmepumpe bei Hausbesitzerin an O-Ton,2023-04-02,20:02:14.02,"0'14""",
Tagesschau,01 Förderprogramm für Austausch alter Heizungen,O-Ton,Robert Habeck,Bundesminister für Wirtschaft und Klimaschutz/Bündnis 90/Die Grünen,(zählt Möglichkeitender finanziellen Unterstützung beim Einbau einer neuen Heizung auf),2023-04-02,20:01:28.22,"0'14""",
Tagesschau,01 Förderprogramm für Austausch alter Heizungen,O-Ton,Klara Geywitz,"Bundesministerin für Wohnen, Stadtentwicklung und Bauwesen/SPD [ZDF]","(EineAbwrackprämie, die die alten Modelle als Erstes vom Markt nimmt, ist durchaus sinnvoll; Prämie wäretechnologieoffen, der Hausbesitzer kann entscheiden, wofür er sie einsetzt)",2023-04-02,20:01:58.09,"0'15""",
Tagesschau,Bundesregierung: Gebäudeenergiegesetz Mi 20:00 01,Einspieler,,,,2023-04-02,,"2'12""","Hier ist das Erste Deutsche Fernsehen mit der tagesschau. Herzlich willkommen zur Live- Untertitelung des NDR (02.04.2023) Heute im Studio: Jens Riewa. Guten Abend, ich begruesse Sie zur tagesschau. Die Bundesregierung arbeitet nach dem Kompromiss zum Austausch von Heizungen an einem Foerderprogramm. Finanzminister Lindner schlug vor, die Unterstuetzung vom Zustand der Anlage abhaengig zu machen. Wirtschaftsminister Habeck sagte im Bericht aus Berlin, niemand werde mit den Kosten ueberfordert. Ab 2024 sollen Heizungen zu 65 % mit erneuerbaren Energien betrieben werden. Geplant sind aber Ausnahmen und ÈUbergangsfristen. Beratung fuer die Umruestung der 20 Jahre alten Heizung, den moegliche Einbau einer Waermepumpe. In den naechsten Jahren steht das fuer viele an. Das Foerderprogramm der Bundesregierung dazu, noch in Arbeit. Es koennte danach gestaffelt werden, wie alt und schmutzig die Heizung ist, sagt der Finanzminister. Im Bericht aus Berlin nennt Habeck Lindners Vorschlag eine Moeglichkeit unter mehreren, um die Buerger zu entlasten. Man koennte es am Einkommen ausrichten. Man koennte die Betraege versteuern, sodass die besser Verdienenden das Gleiche bekommen, aber einen Teil zurueckgeben muessen. Dann haette man die soziale Foerderung des Steuersystems da drin. Die Koalitionspartner seien sich einig, dass die mit wenig Geld beim Umstieg unterstuetzt werden sollten, sagt Habeck. Im ZDF bringt Bundesbauministerin Geywitz eine Abwrackpraemie ins Spiel. Wichtig ist, dass die schmutzigsten Kessel zuerst ausgetauscht werden. Eine Abwrackpraemie ist sinnvoll, die die alten Modelle als erste vom Markt nimmt."
Tagesschau,01 Bundesregierung: Gebäudeenergiegesetz,Sachinhalt,Thorsten Schröder,Moderation,"Die Bundesregierung hat sich auf eine Novelle des Gebäudeenergiegesetzes geeinigt und damit die Umstellung von Heizungen auf Erneuerbare Energien gebilligt. Von 2024 an sollen alle neu eingebauten Heizungen zu mindestens 65 Prozent mit erneuerbaren Energien betrieben werden. Die Vorschriften werden zur Vermeidung sozialer Härten von Ausnahmen, Übergangsregelungen und Förderungsmöglichkeiten flankiert. Der Koalitionspartner FDP erwartet schon jetzt Änderungen am Gesetzentwurf, Kritik kommt von der Opposition. Bildinhalt",2023-04-19,20:00:48.23,"2'12""",
Tagesschau,01 Bundesregierung: Gebäudeenergiegesetz,Bildinhalt,Thorsten Schröder,Moderation,"Demonstration der Gruppe ""Letzte Generation"" in Berlin",2023-04-19,20:00:48.23,"0'16""",
Tagesschau,01 Bundesregierung: Gebäudeenergiegesetz,Bildinhalt,Thorsten Schröder,Moderation,"Christian Lindner, Robert Habeck und Maco Buschmann im Gespräch",2023-04-19,20:01:05.12,"0'06""",
Tagesschau,01 Bundesregierung: Gebäudeenergiegesetz,Bildinhalt,Thorsten Schröder,Moderation,Bundespressekonferenz mit Klara Geywitz und Robert Habeck 15.11.2023 09:44 Seite 4 von 36 NDR Copyright (c) 2004,2023-04-19,20:01:11.21,"0'35""",
Tagesschau,01 Bundesregierung: Gebäudeenergiegesetz,Bildinhalt,Thorsten Schröder,Moderation,Grafik: Förderung Heizungstausch O-Ton,2023-04-19,20:01:47.14,"0'17""",
Tagesschau,01 Bundesregierung: Gebäudeenergiegesetz,O-Ton,Robert Habeck,Bundesminister für Wirtschaft und Klimaschutz/Bündnis 90/Die Grünen,"(Haben großeAufgabe vor uns; beginnen sie recht spät, andere Länder haben das schon früher getan)",2023-04-19,20:01:21.04,"0'07""",
Tagesschau,01 Bundesregierung: Gebäudeenergiegesetz,O-Ton,Klara Geywitz,"Bundesministerin für Wohnen, Stadtentwicklung und Bauwesen/SPD Gesetz wird nicht dazu",,2023-04-19,20:01:36.16,"0'11""",
Tagesschau,01 Bundesregierung: Gebäudeenergiegesetz,O-Ton,Christian Dürr,Fraktionsvorsitzender FDP,"(Es wird im parlamentarischen Verfahren Änderungen amGesetzentwurf geben; im Vergleich zum ursprünglichen Entwurf von Robert Habeck ist er besser geworden,aber wir wollen Technologieoffen sein, weil nicht überall die Wärmepumpe passt)",2023-04-19,20:02:13.24,"0'12""",
Tagesschau,01 Bundesregierung: Gebäudeenergiegesetz,O-Ton,Jens Spahn,stellvertretender Fraktionsvorsitzender CDU/CSU,"(Das Gesetz, so wie es heute im Kabinettbeschlossen wurde, hat schon in der Koalition keine Mehrheit; das Chaos bei der Wärme-Wende geht weiter)",2023-04-19,20:02:30.07,"0'11""",
Tagesschau,01 Bundesregierung: Gebäudeenergiegesetz,O-Ton,Justus Kliss,Korrespondent,Aufsager,2023-04-19,20:02:49.13,"0'12""",
Tagesschau,FDP-Parteitag Sa 20:00 02,Einspieler,,,,2023-04-19,,"1'44""","Hier ist das Erste Deutsche Fernsehen mit der tagesschau. Diese Sendung wurde vom NDR live untertitelt (19.04.2023) Heute im Studio: Thorsten Schroeder. Guten Abend, meine Damen und Herren, ich begruesse Sie zur tagesschau. Die Bundesregierung treibt Plaene zur Modernisierung von Heizungen voran. Das Kabinett brachte einen Gesetzentwurf auf den Weg. Dafuer waren Plaene des Wirtschaftsministeriums ueberarbeitet worden, speziell die Foerdersaetze. Ab 2024 sollen alle neu eingebauten Heizungen zu mindestens 65 % mit Erneuerbaren betrieben werden. Wer die Anlage im selbstgenutzten Wohnraum tauscht, soll mit 30 % gefoerdert werden. In Berlin Stillstand auf der Strasse fuer mehr Tempo beim Klimaschutz. Die Vertreter der ""Letzten Generation"" fordern den kompletten Ausstieg aus fossiler Energie bis 2030. So ambitioniert war das Kabinett nicht: Aber ab 2024 sollen neue Heizungen mit mindestens 65 Prozent erneuerbaren Energien betrieben werden. Der Klimaschutzminister und die Bauministerin sprechen von einem wichtigen Gesetz. Waerme mache 30 Prozent des gesamten Energieverbrauches aus. Wir haben eine grosse Aufgabe vor uns und fangen sie spaet an. Andere Laender haben das frueher getan. Die Bauministerin betont, Heizungen, die funktionieren, muessen nicht ausgetauscht werden und defekte koennen repariert werden. Es wird niemand ohne Heizung da sitzen."
Tagesschau,02 FDP-Parteitag,Sachinhalt,Julia-Niharika Sen,Moderation,"Der FDP-Bundesparteitag hat darüber entschieden, das Gebäudeenergiegesetzes mit den Vorgaben für den Heizungsaustausch komplett zu stoppen. Der FDP-Bezirksverband Ostwestfalen-Lippe hatte einen entsprechenden Dringlichkeitsantrag eingereicht, der auf dem Parteitag angenommen wurde. Bildinhalt",2023-04-22,20:03:28.02,"1'44""",
Tagesschau,02 FDP-Parteitag,Bildinhalt,Julia-Niharika Sen,Moderation,"FDP-Parteitag, u.a. Frank Schäffler unter den Abgeordneten; Internetseite mit Informationen zum Gebäudeenergiegesetz (Antrag D004); Schäffler bei Rede; Applaus Parteimitglieder",2023-04-22,20:03:28.02,"0'52""",
Tagesschau,02 FDP-Parteitag,Bildinhalt,Julia-Niharika Sen,Moderation,Abstimmung Dringlichkeitsantrag; Antrag wird angenommen O-Ton,2023-04-22,20:04:20.23,"0'51""",
Tagesschau,02 FDP-Parteitag,O-Ton,Frank Schäffler,Vorsitzender FDP Ostwestfalen-Lippe,"(Ja wir wollen das Gebäudeenergiegesetz, dassRobert Habeck ja eingebracht hat, dass ja ein Heizungsverbotsgesetz ist, das wollen wir vom Kopf auf dieFüße stellen)",2023-04-22,20:03:45.09,"0'08""",
Tagesschau,02 FDP-Parteitag,O-Ton,Frank Schäffler,Vorsitzender FDP Ostwestfalen-Lippe,"(fordert, dass man den Menschen überlassen sollte,wie sie investieren und dass man sie nicht bevormunden sollte. Und dass dies die liberale Botschaft diesesParteitags sein sollte; bittet um Unterstützung)",2023-04-22,20:04:07.12,"0'13""",
Tagesschau,Lage der Bundes-Grünen vor der Bremenwahl So 20:00 03,Einspieler,,,,2023-04-22,,"1'43""","Hier ist das Erste Deutsche Fernsehen mit der tagesschau. Diese Sendung wurde vom NDR live untertitelt (22.04.2023) Heute im Studio: Julia-Niharika Sen. Guten Abend, ich begruesse Sie zur tagesschau. Die Tarifverhandlungen fuer den oeffentlichen Dienst von Bund und Kommunen sind in der entscheidenden vierten Runde. Grundlage ist die Empfehlung der Schlichtungskommission. Falls sich die Tarifparteien nicht darauf einigen, koennen die Gewerkschaften ueber unbefristete Streiks abstimmen. Die Gewerkschaften fordern mehr vor dem Tagungshotel in Potsdam: 10,5 % mehr Geld, mindestens aber 500 Euro mehr im Monat bei einer Laufzeit von zwoelf Monaten. Uns trifft die Inflation hart. Wir muessen auch unsere Lebenshaltungskosten bezahlen. Alles ist teurer. Wir brauchen eine gerechtere Bezahlung. Drinnen treffen sich Gewerkschaften und Vertreter von Bund und Kommunen. Beamtenbund und ver.di zeigten sich vorsichtig optimistisch: Wie bei jedem Kompromiss gibt es starke Seiten und schwache Seiten. Aus meiner Sicht ist hervorzuheben:"
Tagesschau,03 Lage der Bundes-Grünen vor der Bremenwahl,Sachinhalt,Constantin Schreiber,Moderation,Bündnis 90/Die Grünen befinden sich derzeit im Umfragetief. Im letzten Deutschlandtrend lag die Partei bei 16 Prozent. Zuletzt gab es viel Kritik am Heizungsgesetz oder an vermeintlicher Vetternwirtschaft im grün geführten Bundeswirtschaftsministerium. Bildinhalt,2023-05-07,20:05:15.18,"1'43""",
Tagesschau,03 Lage der Bundes-Grünen vor der Bremenwahl,Bildinhalt,Constantin Schreiber,Moderation,"Regieraum ""Bericht aus Berlin"", Grünen-Vorsitzende Ricarda Lang zu Gast im Studio",2023-05-07,20:05:15.18,"0'22""",
Tagesschau,03 Lage der Bundes-Grünen vor der Bremenwahl,Bildinhalt,Constantin Schreiber,Moderation,Archivmaterial (06.05.2023): Bündnis 90/Die Grünen feiern in Leipzig 30. Jubiläum des Zusammenschlusses von Bündnis 90 und Die Grünen,2023-05-07,20:05:56.12,"0'07""",
Tagesschau,03 Lage der Bundes-Grünen vor der Bremenwahl,Bildinhalt,Constantin Schreiber,Moderation,"Ricarda Lang als Studiogast im ""Bericht aus Berlin""",2023-05-07,20:06:13.01,"0'05""",
Tagesschau,03 Lage der Bundes-Grünen vor der Bremenwahl,Bildinhalt,Constantin Schreiber,Moderation,Heizungsbauer bei der Arbeit,2023-05-07,20:06:18.14,"0'09""",
Tagesschau,03 Lage der Bundes-Grünen vor der Bremenwahl,Bildinhalt,Constantin Schreiber,Moderation,Archivmaterial (06.05.2023): Bündnis 90/Die Grünen feiern in Leipzig 30. Jubiläum des Zusammenschlusses von Bündnis 90 und Grüne O-Ton,2023-05-07,20:06:48.16,"0'11""",
Tagesschau,03 Lage der Bundes-Grünen vor der Bremenwahl,O-Ton,Ricarda Lang,Vorsitzende Bündnis 90/Die Grünen,"(""Glaubwürdigkeit geht, indem wir klare Regeln haben,indem wir uns auch nicht verunsichern lassen und indem wir jetzt die Fragen, die die Bürgerinnen und Bürgertatsächlich umtreiben, z. B. soziale Frage, beantworten"")",2023-05-07,20:05:37.21,"0'18""",
Tagesschau,03 Lage der Bundes-Grünen vor der Bremenwahl,O-Ton,Sabine Kropp,Politikwissenschaftlerin Freie Universität Berlin,,2023-05-07,20:06:04.12,"0'08""",
Tagesschau,03 Lage der Bundes-Grünen vor der Bremenwahl,O-Ton,"Ricarda Lang (""Die Alternative zur Veränderung ist nicht","dass alles bleibt, wie es ist. Die Alternative ist, dass","(""Die Alternative zur Veränderung ist nicht, dass alles bleibt, wie es ist. Die Alternative ist, dasses unsicherer, teurer und gefährlicher wird. Aber, wenn wir jetzt sagen, wir gehen diese Veränderung an, dasmachen wir gemeinsam, ... dann heißt das doch jetzt auch, dass wir gemeinsam Geld in die Hand nehmen,um sie [die Bürger] dabei zu unterstützen"")",2023-05-07,20:06:27.15,"0'21""",
Tagesschau,Reaktionen Wahl Bürgerschaft Bremen Mo 20:00 03,Einspieler,,,,2023-05-07,,"1'56""","Hier ist das Erste Deutsche Fernsehen mit der tagesschau. Diese Sendung wurde vom NDR live untertitelt (07.05.2023) Heute im Studio: Constantin Schreiber. Guten Abend, ich begruesse Sie zur tagesschau. Sie gilt als ein Symbol fuer marode Infrastruktur in Deutschland: Die Talbruecke Rahmede in Nordrhein-Westfalen. Heute ist sie erfolgreich gesprengt worden. Die Bruecke an der A45, einer zentralen Nord-Sued-Achse, lag zwischen Luedenscheid-Nord und Luedenscheid. Seit Dezember 2021 war sie voll gesperrt. Mit drastischen Auswirkungen auf den Verkehr und die Wirtschaft. Drei, zwo, eins, Zuendung! * Knall * Sekundenschnell war vorbei, was jahrelange Vorbereitung brauchte. 17.000 Tonnen Beton und Stahl krachen aus 70 Metern Hoehe in die Tiefe. Jubel. Erleichterung. Bei Anwohnern, die sich die Sprengung nicht entgehen lassen wollten. Seit Ende 2021 geht auf der Bruecke nichts mehr. Pendler, Lastwagen quaelen sich auf Umwegen durch Luedenscheid. Anwohner zogen weg. Der Region entsteht ein Schaden in Milliardenhoehe, berechnet das Institut der Deutschen Wirtschaft. Einige Unternehmen muessen Insolvenz anmelden, andere mit steigenden Kosten klarkommen. Die Umwege durch die fehlende Bruecke kosten das Unternehmen viel Geld. Zum Teil doppelte Ausgaben, um das Material verlaesslich zum Kunden zu bringen. Sie muessen sich vorstellen, dass wir fast fuer jede Tour gen Suedwestfalen"
Tagesschau,03 Reaktionen Wahl Bürgerschaft Bremen,Sachinhalt,Julia-Niharika Sen,Moderation,"Reaktionen der Bundesparteien zum Wahlausgang der Bürgerschaftswahl in Bremen. Die SPD von Bürgermeister Andreas Bovenschulte hat nach aktueller Hochrechnung mit 30,1 Prozent einen deutlichen Sieg errungen. Die CDU landete mit 25 Prozent auf dem zweiten Platz, die mitregierenden Bündnis 90/Die Grünen mussten deutliche Verluste einstecken, die Linke blieb stabil und die FDP schaffte die Fünf-Prozent- Hürde. Bildinhalt",2023-05-15,20:04:46.11,"1'56""",
Tagesschau,03 Reaktionen Wahl Bürgerschaft Bremen,Bildinhalt,Julia-Niharika Sen,Moderation,Andreas Bovenschulte nimmt Gratulationen von Parteigenossen in der SPD-Parteizentrale entgegen,2023-05-15,20:04:46.11,"0'17""",
Tagesschau,03 Reaktionen Wahl Bürgerschaft Bremen,Bildinhalt,Julia-Niharika Sen,Moderation,Parteizentrale und Pressekonferenz Bündnis 90/Die Grünen,2023-05-15,20:05:17.04,"0'20""",
Tagesschau,03 Reaktionen Wahl Bürgerschaft Bremen,Bildinhalt,Julia-Niharika Sen,Moderation,"Kristina Vogt, Spitzenkandidatin Die Linke Bremen, mit Blumenstrauß auf Pressekonferenz von Die Linke 15.11.2023 09:44 Seite 8 von 36 NDR Copyright (c) 2004",2023-05-15,20:05:38.03,"0'15""",
Tagesschau,03 Reaktionen Wahl Bürgerschaft Bremen,Bildinhalt,Julia-Niharika Sen,Moderation,Parteizentrale und Pressekonferenz CDU,2023-05-15,20:05:54.03,"0'22""",
Tagesschau,03 Reaktionen Wahl Bürgerschaft Bremen,Bildinhalt,Julia-Niharika Sen,Moderation,Bundesgeschäftsstelle (Schild) und Pressekonferenz der FDP,2023-05-15,20:06:16.06,"0'17""",
Tagesschau,03 Reaktionen Wahl Bürgerschaft Bremen,Bildinhalt,Julia-Niharika Sen,Moderation,Skulptur und Bundeskanzleramt (Gebäude außen) O-Ton,2023-05-15,20:06:33.13,"0'09""",
Tagesschau,03 Reaktionen Wahl Bürgerschaft Bremen,O-Ton,Lars Klingbeil,Vorsitzender SPD,"(zum geplanten Heizungsgesetz: ""Wir wollen die soziale Förderung auf denWeg bringen, das heißt auch Förderung gestaffelt nach Einkommen. Wir werden als SPD darauf achten,dass der Mieterschutz gestärkt wird. Es kann nicht sein, dass die Kosten am Ende auf die Mieter umgelegtwerden"")",2023-05-15,20:05:03.24,"0'13""",
Tagesschau,03 Reaktionen Wahl Bürgerschaft Bremen,O-Ton,Omid Nouripour,Vorsitzender Bündnis 90/Die Grünen,"(""Wir sind für Sondierungsgespräche ... bereit, weil wirhoffen, dass wir weiter mitwirken können"")",2023-05-15,20:05:30.20,"0'07""",
Tagesschau,03 Reaktionen Wahl Bürgerschaft Bremen,O-Ton,Martin Schirdewan,Vorsitzender Die Linke,"(""Es ist ein Grund zur Freude für die gesamte Partei ... DiesesErgebnis wird uns entsprechend auch Rückenwind geben für die gesamte Partei"")",2023-05-15,20:05:45.07,"0'08""",
Tagesschau,03 Reaktionen Wahl Bürgerschaft Bremen,O-Ton,Friedrich Merz,Vorsitzender CDU,"(""Deshalb möchte ich auch an die SPD appellieren, jetzt auch die Chancewahrzunehmen, mit der CDU in Bremen Gespräche zu führen über eine mögliche Zusammenarbeit inBremen"")",2023-05-15,20:06:03.09,"0'12""",
Tagesschau,03 Reaktionen Wahl Bürgerschaft Bremen,O-Ton,Christian Lindner,Vorsitzender FDP,"(""Wir arbeiten mit fröhlicher Penetranz daran, dass Deutschlandliberaler, moderner und digitaler wird"")",2023-05-15,20:06:24.03,"0'09""",
Tagesschau,Debatte um Gebäudeenergiegesetz Do 20:00 01,Einspieler,,,,2023-05-15,,"1'50""","Hier ist das Erste Deutsche Fernsehen mit der tagesschau. Diese Sendung wurde vom NDR live untertitelt (15.05.2023) Heute im Studio: Julia-Niharika Sen. Guten Abend, ich begruesse Sie zur tagesschau. In der Tuerkei wird zum ersten Mal in einer Stichwahl ueber den Praesidenten entschieden. Bei der Abstimmung gestern holte Erdogan die meisten Stimmen, verfehlte wie Herausforderer Kilicdaroglu die absolute Mehrheit. In zwei Wochen ist die entscheidende Runde. Die Wahl in der Tuerkei gilt als eine der weltweit wichtigsten in diesem Jahr. Sie ist richtungsweisend fuer die Zukunft des Landes. Stichwahl nach einem Wahlkrimi. Am Nachmittag verkuendigt der Chef der Wahlkommission, dass fuer keinen der beiden Kandidaten reicht. Am Morgen nach der Wahl kommt das Leben nur langsam in die Gaenge. Die Anhaenger der Opposition fanden den Wahlkampf unfair, hatten sich mehr erhofft. Die Unterstuetzer der Regierung koennen mit dem Ergebnis leben. Ich hatte erwartet, dass unser Praesident gewinnt. Nicht nur erwartet. Es war offensichtlich, dass er gewinnt. Ich bin enttaeuscht. Aber am Ende hat der Praesident alle Mittel zur Verfuegung. Seine AKP gewinnt auch deshalb. Erdogan, seit 20 Jahren im Amt, muss in die Stichwahl. Fuer ihn das erste Mal. Dennoch zeigt er sich gestern Nacht siegessicher. Trotz schlechter Wirtschaftslage und hoher Inflation gilt er als Favorit. Auch, weil er Medien und den Staatsapparat hinter sich hat. Die Opposition: geschockt. In vielen Umfragen lag Herausforderer Kilicdaroglu vorne."
Tagesschau,01 Debatte um Gebäudeenergiegesetz,O-Ton,Julia Klöckner,Fraktion CDU/CSU,"(Ich erwarte von Minister Habeck, dass er jetzt einfach mal auf dieStopptaste drückt, dass er nicht mit der Brechstange versucht, ein Gesetz durchzudrücken, was gegen jedewissenschaftliche Berechnung ist, was auch gegen die Wünsche und Bedürfnisse der Bürgerinnen undBürger ist und vor allen Dingen das überhaupt nicht technologieoffen ist)",2023-05-18,20:01:25.13,"0'19""",
Tagesschau,01 Debatte um Gebäudeenergiegesetz,O-Ton,Andreas Audretsch,stellvertretender Fraktionsvorsitzender Bündnis 90/Die Grünen,"(Im Kabinett habenwieder alle zugestimmt, und deswegen sind wir jetzt in den parlamentarischen Beratungen auch genau aufdiesem Weg. Vor dem Sommer wird es einen Beschluss über das Gebäudeenergiegesetz im DeutschenBundestag geben)",2023-05-18,20:01:57.17,"0'09""",
Tagesschau,Philipp Nimmermann wird Graichen-Nachfolger Mo 20:00 01,Einspieler,,,,2023-05-18,,"2'31""","Hier ist das Erste Deutsche Fernsehen mit der tagesschau. Diese Sendung wurde vom NDR live untertitelt (18.05.2023) Heute im Studio: Thorsten Schroeder. Guten Abend, ich begruesse Sie zur tagesschau. Nach der Entlassung von Wirtschaftsstaatssekretaer Graichen gibt es neuen Streit ueber das Gebaeudeenergiegesetz. Die FDP stellt jetzt den Zeitplan fuer das umstrittene Vorhaben zum Austausch von ÈOl- und Gasheizungen in Frage. Die Begruendung: Dem Bundestag fehle nun der Ansprechpartner fuer das Gesetz. SPD und Gruene sehen keinen Zusammenhang. Sichtlich angefasst verkuendet der Wirtschaftsminister gestern die Versetzung seines Staatssekretaers in den Ruhestand. Auch aus seiner Sicht ist der Schritt unausweichlich. Der gesamte Zeitplan fuer das Heizungsgesetz geraet in Schieflage. Auch im Regierungslager. Es gibt viele Dinge, die an diesem Gesetz geaendert werden muessen. Es muss zurueck in die Montagehalle und in einem neuen Entwurf beraten werden. Viele Einzelheiten umstritten und der zustaendige Staatssekretaer muss gehen. Dass Habeck sein Heizungsgesetz vor der Sommerpause durchbringt, scheint fraglich. Die Union fordert die Regierung auf, das Vorhaben ganz aufzugeben. Ich erwarte von Minister Habeck, dass er die Stopp-Taste drueckt. Dass er nicht versucht, ein Gesetz durchzudruecken gegen wissenschaftliche Berechnung. Das gegen die Wuensche der Buergerinnen und Buerger ist und das nicht technologieoffen ist. Die Gruenen ficht der Vorwurf nicht an. Der naechste Schritt zur Energiewende werde nun zuegig gegangen. So sei es im Koalitionsausschuss mit SPD und FDP vereinbart worden. Im Kabinett haben wieder alle zugestimmt. Deswegen sind wir jetzt genau auf diesem Weg. Vor dem Sommer wird es einen Beschluss ueber das Gesetz geben. Auch die SPD moechte den Zeitplan halten. Die juengste Personalentscheidung im Wirtschaftsministerium duerfe die Energiewende nicht ausbremsen. Das koennen wir nur erreichen, wenn wir zuegig ins Verfahren eintreten und es zuegig abschliessen. Robert Habeck hat ein personelles Problem erledigt. Inhaltlich kommt er der Energiewende nicht naeher."
